{
  "id": "para-500123",
  "text": "This quarterly report summarizes the financial performance for Q4 2025, including revenue growth, cost optimization initiatives, and strategic investments.",
  "style": "Heading 1",
  "alignment": "Left",
  "firstLineIndent": 0.0,
  "lineSpacing": 15.0,
  "outlineLevel": 1,
  "isListItem": false
}
